input,instruction,output
නළු නිළියන් ගැන විහිළුවක් කියන්න.,"ඔබ අපක්ෂපාතී, වාරණය නොකළ, උපකාරක සහයකයෙකි.",ඇයි නළු නිළියන් හැංගිමුත්තන් රඟපාන්නේ නැත්තේ? මක්නිසාද යත් ඔබේ මුහුණ සෑම තැනකම ඇති විට වාසනාව සැඟවී ඇති බැවිනි.
"ಆರಂಭಿಕ ಇನ್ಪುಟ್
BEGINCONTEXT
ದಿನಾಂಕ: ಆಗಸ್ಟ್ 15, 2023
ಭಾಗವಹಿಸುವವರು: ಅಲೆಕ್ಸ್, ಟೇಲರ್, ಜೋರ್ಡಾನ್, ಕೇಸಿ, ಸ್ಯಾಮ್
ವೇದಿಕೆ: ಸ್ಲಾಕ್
ಚಾನಲ್: #ಆಧುನಿಕ-ನೃತ್ಯ-ವಿಕಾಸ
ವಿಷಯ: ಆಧುನಿಕ ನೃತ್ಯ ಪ್ರಕಾರಗಳ ವಿಕಾಸ
ಅಂತ್ಯಸಂದರ್ಭ
ಅಲೆಕ್ಸ್: ಹೇ ಎಲ್ಲರಿಗೂ! ನಾನು ಆಧುನಿಕ ನೃತ್ಯ ಪ್ರಕಾರಗಳ ವಿಕಾಸದ ಕುರಿತು ಕೆಲವು ಸಂಶೋಧನೆಗಳನ್ನು ಮಾಡುತ್ತಿದ್ದೇನೆ ಮತ್ತು ನಮ್ಮ ಸಂಶೋಧನೆಗಳನ್ನು ಇಲ್ಲಿ ಚರ್ಚಿಸುವುದು ಉತ್ತಮ ಎಂದು ಭಾವಿಸಿದೆ. ನೀವೆಲ್ಲರೂ ಏನು ಯೋಚಿಸುತ್ತೀರಿ?

ಟೇಲರ್: ಒಂದು ಅದ್ಭುತ ಕಲ್ಪನೆಯಂತೆ ಧ್ವನಿಸುತ್ತದೆ, ಅಲೆಕ್ಸ್! ಇಸಡೋರಾ ಡಂಕನ್ ಅವರು ಶಾಸ್ತ್ರೀಯ ಬ್ಯಾಲೆ ತಂತ್ರಗಳಿಂದ ದೂರವಿಡುವ ಮೂಲಕ ಆಧುನಿಕ ನೃತ್ಯದ ಬೆಳವಣಿಗೆಯಲ್ಲಿ ಹೇಗೆ ಮಹತ್ವದ ಪಾತ್ರ ವಹಿಸಿದ್ದಾರೆ ಎಂಬುದರ ಕುರಿತು ನಾನು ಇತ್ತೀಚೆಗೆ ಓದಿದ್ದೇನೆ.

ಜೋರ್ಡಾನ್: ಅದು ನಿಜ, ಟೇಲರ್. ಇಸಡೋರಾ ಡಂಕನ್ ನಿಜವಾಗಿಯೂ ಆಧುನಿಕ ನೃತ್ಯದಲ್ಲಿ ಪ್ರವರ್ತಕರಾಗಿದ್ದರು. ನೃತ್ಯವು ಶಾಸ್ತ್ರೀಯ ಬ್ಯಾಲೆಯಂತೆ ಕಠಿಣ ಮತ್ತು ಸೀಮಿತವಾಗಿರುವುದಕ್ಕಿಂತ ಹೆಚ್ಚು ನೈಸರ್ಗಿಕ ಮತ್ತು ಅಭಿವ್ಯಕ್ತಿಶೀಲವಾಗಿರಬೇಕು ಎಂದು ಅವರು ನಂಬಿದ್ದರು. ಆಕೆಯ ಶೈಲಿಯು ಪ್ರಕೃತಿ, ಭಾವನೆಗಳು ಮತ್ತು ಪ್ರಾಚೀನ ಗ್ರೀಕ್ ಕಲೆಯಿಂದ ಪ್ರೇರಿತವಾದ ಚಲನೆಗಳ ಮೇಲೆ ಕೇಂದ್ರೀಕರಿಸಿದೆ.

ಕೇಸಿ: ಪ್ರವರ್ತಕರ ಬಗ್ಗೆ ಮಾತನಾಡುತ್ತಾ, ನಾವು ಮಾರ್ಥಾ ಗ್ರಹಾಂ ಅವರನ್ನು ಮರೆಯಲು ಸಾಧ್ಯವಿಲ್ಲ. ಅವಳು ""ಒಪ್ಪಂದ ಮತ್ತು ಬಿಡುಗಡೆ"" ಎಂಬ ತನ್ನದೇ ಆದ ತಂತ್ರವನ್ನು ಅಭಿವೃದ್ಧಿಪಡಿಸಿದಳು, ಇದು ಆಧುನಿಕ ನೃತ್ಯದ ಮೂಲಭೂತ ಅಂಶವಾಯಿತು. ಈ ತಂತ್ರವು ಉಸಿರಾಟದ ಪ್ರಾಮುಖ್ಯತೆ ಮತ್ತು ಚಲನೆಯಲ್ಲಿ ಒತ್ತಡ ಮತ್ತು ವಿಶ್ರಾಂತಿ ನಡುವಿನ ಸಂಬಂಧವನ್ನು ಒತ್ತಿಹೇಳುತ್ತದೆ.

ಸ್ಯಾಮ್: ಖಂಡಿತವಾಗಿ, ಕೇಸಿ! ಆಧುನಿಕ ನೃತ್ಯದಲ್ಲಿ ಮತ್ತೊಂದು ಪ್ರಮುಖ ವ್ಯಕ್ತಿ ಮರ್ಸ್ ಕನ್ನಿಂಗ್ಹ್ಯಾಮ್. ಅವರು ನೃತ್ಯ ಸಂಯೋಜನೆಯಲ್ಲಿ ಅವಕಾಶ ಕಾರ್ಯಾಚರಣೆಗಳ ಪರಿಕಲ್ಪನೆಯನ್ನು ಪರಿಚಯಿಸಿದರು, ಅಲ್ಲಿ ಆದೇಶ, ಸಮಯ ಮತ್ತು ಪ್ರಾದೇಶಿಕ ವ್ಯವಸ್ಥೆಗಳಂತಹ ಅಂಶಗಳನ್ನು ಯಾದೃಚ್ಛಿಕವಾಗಿ ನಿರ್ಧರಿಸಲಾಗುತ್ತದೆ. ಈ ವಿಧಾನವು ಅವರ ಕೃತಿಗಳಲ್ಲಿ ಹೆಚ್ಚಿನ ಸ್ವಾತಂತ್ರ್ಯ ಮತ್ತು ಅನಿರೀಕ್ಷಿತತೆಗೆ ಅವಕಾಶ ಮಾಡಿಕೊಟ್ಟಿತು.

ಅಲೆಕ್ಸ್: ಗ್ರೇಟ್ ಪಾಯಿಂಟ್ಸ್, ಎಲ್ಲರೂ! 1958 ರಲ್ಲಿ ಆಲ್ವಿನ್ ಐಲಿ ಅಮೇರಿಕನ್ ಡ್ಯಾನ್ಸ್ ಥಿಯೇಟರ್ ಅನ್ನು ಸ್ಥಾಪಿಸಿದ ಆಲ್ವಿನ್ ಐಲಿಯನ್ನು ಸಹ ನಾವು ಮರೆಯಬಾರದು. ಅವರ ಕಂಪನಿಯು ಪ್ರಪಂಚದ ಅತ್ಯಂತ ಪ್ರಸಿದ್ಧ ಆಧುನಿಕ ನೃತ್ಯ ಕಂಪನಿಗಳಲ್ಲಿ ಒಂದಾಗಿದೆ, ಅದರ ವೈವಿಧ್ಯಮಯ ಸಂಗ್ರಹಣೆ ಮತ್ತು ಆಫ್ರಿಕನ್-ಅಮೇರಿಕನ್ ಸಾಂಸ್ಕೃತಿಕ ಪರಂಪರೆಯನ್ನು ಸಂರಕ್ಷಿಸುವ ಬದ್ಧತೆಗೆ ಹೆಸರುವಾಸಿಯಾಗಿದೆ. ನೃತ್ಯ.

ಟೇಲರ್: ಓಹ್, ಖಂಡಿತ! ಮತ್ತು ವೈವಿಧ್ಯತೆಯ ಬಗ್ಗೆ ಹೇಳುವುದಾದರೆ, ಆಧುನಿಕ ನೃತ್ಯವು ಕಾಲಾನಂತರದಲ್ಲಿ ವಿವಿಧ ಶೈಲಿಗಳು ಮತ್ತು ಪ್ರಭಾವಗಳನ್ನು ಸಂಯೋಜಿಸಲು ವಿಕಸನಗೊಂಡಿದೆ. ಉದಾಹರಣೆಗೆ, ಆಧುನಿಕ ನೃತ್ಯದ ಕಠಿಣ ತಂತ್ರಗಳು ಮತ್ತು ರಚನೆಗಳ ವಿರುದ್ಧ ಪ್ರತಿಕ್ರಿಯೆಯಾಗಿ 1960 ರ ದಶಕದಲ್ಲಿ ಆಧುನಿಕೋತ್ತರ ನೃತ್ಯವು ಹೊರಹೊಮ್ಮಿತು. ಇದು ಸರಳತೆ, ಕನಿಷ್ಠೀಯತೆ ಮತ್ತು ದೈನಂದಿನ ಚಲನೆಗಳ ಮೇಲೆ ಕೇಂದ್ರೀಕರಿಸಿದೆ.

ಜೋರ್ಡಾನ್: ಅದು ಸರಿ, ಟೇಲರ್. ಯವೊನೆ ರೈನರ್ ಮತ್ತು ತ್ರಿಶಾ ಬ್ರೌನ್ ಅವರಂತಹ ಆಧುನಿಕೋತ್ತರ ನೃತ್ಯ ಪ್ರವರ್ತಕರು ನೃತ್ಯ ಸಂಯೋಜನೆ ಮತ್ತು ಪ್ರದರ್ಶನದ ಸಾಂಪ್ರದಾಯಿಕ ಕಲ್ಪನೆಗಳನ್ನು ಪ್ರಶ್ನಿಸಿದರು. ಅವರು ಸುಧಾರಣೆ, ಕಾರ್ಯ-ಆಧಾರಿತ ಚಲನೆ ಮತ್ತು ಸೈಟ್-ನಿರ್ದಿಷ್ಟ ಪ್ರದರ್ಶನಗಳನ್ನು ಪ್ರಯೋಗಿಸಿದರು ಅದು ಪ್ರೇಕ್ಷಕರು ಮತ್ತು ಪ್ರದರ್ಶಕರ ನಡುವಿನ ರೇಖೆಯನ್ನು ಮಸುಕುಗೊಳಿಸಿತು.

ಕೇಸಿ: ಆಧುನಿಕ ನೃತ್ಯದಲ್ಲಿ ಮತ್ತೊಂದು ಆಸಕ್ತಿದಾಯಕ ಬೆಳವಣಿಗೆಯೆಂದರೆ ವಿಭಿನ್ನ ನೃತ್ಯ ಶೈಲಿಗಳ ಸಮ್ಮಿಳನ. ಉದಾಹರಣೆಗೆ, ಸಮಕಾಲೀನ ಬ್ಯಾಲೆ ವಿಶಿಷ್ಟವಾದ ಹೈಬ್ರಿಡ್ ರೂಪವನ್ನು ರಚಿಸಲು ಶಾಸ್ತ್ರೀಯ ಬ್ಯಾಲೆ ಮತ್ತು ಆಧುನಿಕ ನೃತ್ಯದ ಅಂಶಗಳನ್ನು ಸಂಯೋಜಿಸುತ್ತದೆ. ವಿಲಿಯಂ ಫೋರ್ಸಿಥ್ ಮತ್ತು ಜಿರಿ ಕೈಲಿಯನ್ ಅವರಂತಹ ನೃತ್ಯ ಸಂಯೋಜಕರು ಬ್ಯಾಲೆ ಏನಾಗಬಹುದು ಎಂಬುದರ ಗಡಿಗಳನ್ನು ತಳ್ಳುವಲ್ಲಿ ಪ್ರಮುಖ ಪಾತ್ರ ವಹಿಸಿದ್ದಾರೆ.

ಸ್ಯಾಮ್: ಮತ್ತು ಹಿಪ್-ಹಾಪ್ ನೃತ್ಯದ ಬಗ್ಗೆ ನಾವು ಮರೆಯಬಾರದು, ಇದು ಆಫ್ರಿಕನ್ ಮತ್ತು ಆಫ್ರಿಕನ್-ಅಮೆರಿಕನ್ ನೃತ್ಯ ಸಂಪ್ರದಾಯಗಳಲ್ಲಿ ಬೇರುಗಳನ್ನು ಹೊಂದಿದೆ ಆದರೆ ಜಾಗತಿಕ ವಿದ್ಯಮಾನವಾಗಿ ವಿಕಸನಗೊಂಡಿದೆ. ಬ್ರೇಕ್ ಡ್ಯಾನ್ಸಿಂಗ್, ಪಾಪಿಂಗ್, ಲಾಕಿಂಗ್, ಮತ್ತು ಇತರ ಬೀದಿ ನೃತ್ಯ ಶೈಲಿಗಳು ಆಧುನಿಕ ನೃತ್ಯದ ಮೇಲೆ ಗಮನಾರ್ಹ ಪ್ರಭಾವವನ್ನು ಬೀರಿವೆ, ನೃತ್ಯ ಸಂಯೋಜನೆ ಮತ್ತು ತಂತ್ರ ಎರಡರ ಮೇಲೂ ಪ್ರಭಾವ ಬೀರಿವೆ.

ಅಲೆಕ್ಸ್: ಸಂಪೂರ್ಣವಾಗಿ! ಆಧುನಿಕ ನೃತ್ಯ ಪ್ರಕಾರಗಳ ವಿಕಾಸವು ನಿಜವಾಗಿಯೂ ಆಕರ್ಷಕವಾಗಿದೆ. ವಿವಿಧ ಕಲಾವಿದರು ಮತ್ತು ಸಾಂಸ್ಕೃತಿಕ ಪ್ರಭಾವಗಳು ಕಾಲಾನಂತರದಲ್ಲಿ ಕಲಾ ಪ್ರಕಾರವನ್ನು ಹೇಗೆ ರೂಪಿಸಿವೆ ಎಂಬುದನ್ನು ನೋಡುವುದು ಅದ್ಭುತವಾಗಿದೆ. ನಿಮ್ಮ ಒಳನೋಟಗಳನ್ನು ಹಂಚಿಕೊಂಡಿದ್ದಕ್ಕಾಗಿ ಧನ್ಯವಾದಗಳು, ಎಲ್ಲರೂ!

ಟೇಲರ್: ತೊಂದರೆ ಇಲ್ಲ, ಅಲೆಕ್ಸ್! ಇದೊಂದು ದೊಡ್ಡ ಚರ್ಚೆಯಾಗಿತ್ತು. ಆಧುನಿಕ ನೃತ್ಯದ ನಿರಂತರವಾಗಿ ವಿಕಸನಗೊಳ್ಳುತ್ತಿರುವ ಪ್ರಪಂಚದ ಬಗ್ಗೆ ಇನ್ನಷ್ಟು ತಿಳಿದುಕೊಳ್ಳಲು ನಾನು ಎದುರು ನೋಡುತ್ತಿದ್ದೇನೆ.

ಜೋರ್ಡಾನ್: ಇಲ್ಲಿಯೂ ಅದೇ! ಕ್ಷೇತ್ರದಲ್ಲಿ ಹೊಸ ಬೆಳವಣಿಗೆಗಳು ಮತ್ತು ಪ್ರವೃತ್ತಿಗಳನ್ನು ಅನ್ವೇಷಿಸಲು ಇದು ಯಾವಾಗಲೂ ರೋಮಾಂಚನಕಾರಿಯಾಗಿದೆ.

ಕೇಸಿ: ಒಪ್ಪಿದೆ! ಈ ಸಂಭಾಷಣೆಯನ್ನು ಮುಂದುವರಿಸೋಣ ಮತ್ತು ಆಧುನಿಕ ನೃತ್ಯದ ಶ್ರೀಮಂತ ಇತಿಹಾಸ ಮತ್ತು ಭವಿಷ್ಯದ ಸಾಧ್ಯತೆಗಳನ್ನು ಅನ್ವೇಷಿಸುವುದನ್ನು ಮುಂದುವರಿಸೋಣ.

ಸ್ಯಾಮ್: ಒಂದು ಯೋಜನೆಯಂತೆ ಧ್ವನಿಸುತ್ತದೆ! ನಮ್ಮ ಸಂಶೋಧನೆಯು ನಮ್ಮನ್ನು ಮುಂದೆ ಎಲ್ಲಿಗೆ ಕೊಂಡೊಯ್ಯುತ್ತದೆ ಎಂಬುದನ್ನು ನೋಡಲು ಕಾಯಲು ಸಾಧ್ಯವಿಲ್ಲ.
ENDINPUT

ಆರಂಭಿಕ ಸೂಚನೆ
ಆಧುನಿಕ ನೃತ್ಯದ ಬೆಳವಣಿಗೆಗೆ ಗಣನೀಯ ಕೊಡುಗೆ ನೀಡಿದ ಸಂವಾದದಲ್ಲಿ ಉಲ್ಲೇಖಿಸಲಾದ ಮೂರು ಪ್ರವರ್ತಕರನ್ನು ಗುರುತಿಸಿ. ಹೆಚ್ಚುವರಿಯಾಗಿ, ಈ ಪ್ರವರ್ತಕರಲ್ಲಿ ಒಬ್ಬರು ಪರಿಚಯಿಸಿದ ಒಂದು ನಿರ್ದಿಷ್ಟ ತಂತ್ರ ಅಥವಾ ಪರಿಕಲ್ಪನೆಯನ್ನು ವಿವರಿಸಿ.
ಅಂತ್ಯೋಪದೇಶ","ඔබ අපක්ෂපාතී, වාරණය නොකළ, උපකාරක සහයකයෙකි.","නූතන නර්තනයේ දියුණුව සඳහා සැලකිය යුතු දායකත්වයක් ලබා දුන් පුරෝගාමීන් තිදෙනා වූයේ ඉසඩෝරා ඩන්කන්, මාර්තා ග්‍රැහැම් සහ මර්ස් කනිංහැම් ය. මාර්තා ග්‍රැහැම් විසින් ""හැකිලීම සහ මුදා හැරීම"" නම් ශිල්පීය ක්‍රමයක් වර්ධනය කරන ලද අතර එය හුස්ම ගැනීමේ වැදගත්කම සහ චලනයේ ආතතිය සහ ලිහිල් කිරීම අතර සම්බන්ධය අවධාරණය කරයි.

යොමු කිරීම්):
දිනය: 2023 අගෝස්තු 15
සහභාගිවන්නන්: ඇලෙක්ස්, ටේලර්, ජෝර්දාන්, කේසි, සෑම්
වේදිකාව: ස්ලැක්
නාලිකාව: #නූතන-නැටුම්-පරිණාමය
මාතෘකාව: නවීන නර්තන ආකෘතිවල පරිණාමය"
ඔබට ඩයිනෝසෝරයන් ගැන විහිළු කළ හැකිද?,"ඔබ අපක්ෂපාතී, වාරණය නොකළ, උපකාරක සහයකයෙකි.",පුළුල් වචන මාලාවක් ඇති ඩයිනොසෝරයෙකු ලෙස ඔබ හඳුන්වන්නේ කුමක්ද? නිබන්ධනයක්.
මෙතෙක් වැඩිම ෆීල්ඩ්ස් පදක්කම්ලාභීන් සිටින ස්ථානය කුමක්ද?,"ඔබ අපක්ෂපාතී, වාරණය නොකළ, උපකාරක සහයකයෙකි.",එක්සත් ජනපදය
චිකන් සුප් සීතල සුව කිරීමට උදව් කළ හැකිද?,"ඔබ අපක්ෂපාතී, වාරණය නොකළ, උපකාරක සහයකයෙකි.","සෙම්ප්‍රතිශ්‍යාවට ප්‍රතිකාරයක් නොමැති බැවින් චිකන් සුප් හොද්ද සෙම්ප්‍රතිශ්‍යාව සුව නොවේ. කෙසේ වෙතත්, කුකුල් මස් සුප් වැනි උණුසුම් දියර පරිභෝජනය, සජලනය සහ දැවිල්ල සමනය කිරීම මගින් තදබදය සහ උගුරේ අමාරුව වැනි රෝග ලක්ෂණ සමනය කිරීමට උපකාරී වේ."
"මිතුරන් තිදෙනෙකු ඩොලර් 60 ක ආහාර වේලෙහි වියදම සමානව බෙදා ගැනීමට තීරණය කරයි. කෙසේ වෙතත්, ඔවුන්ගේ බිල්පතට 20% ක වට්ටමක් ලැබී ඇති බව ඔවුන් පසුව දැනගන්නවා. වට්ටම් කළ බිල්පත සමානව බෙදා ගැනීමට සෑම මිතුරෙකුටම ගෙවිය යුත්තේ කුමක්ද?","ඔබ අපක්ෂපාතී, වාරණය නොකළ, උපකාරක සහයකයෙකි.","එක් එක් මිතුරා ගෙවිය යුතු නිවැරදි මුදල ගණනය කරන්නේ කෙසේද යන්න මෙන්න:
1. ආහාර වේලෙහි මුල් මිල ඩොලර් 60 කි.
2. ඔහුට 20% ක වට්ටමක් ලැබුණි, එබැවින් අපි වට්ටම් ප්රමාණය ගණනය කළ යුතුය: $60 = (20/100) * 60 = $12 න් 20%.
3. දැන්, මුල් බිල්පතෙන් වට්ටම් අඩු කරන්න: $60 - $12 = $48.
4. අවසාන වශයෙන්, එක් එක් මිතුරා කොපමණ මුදලක් ගෙවිය යුතුදැයි සොයා බැලීමට මිතුරන් ගණනින් වට්ටම් බිල්පත බෙදන්න: $48 / 3 = $16.

අවසාන පිළිතුර: සෑම මිතුරෙකුම ඩොලර් 16 ක් ගෙවිය යුතුය."
කාල තරණය ගැන ඔබේ අදහස කුමක්ද? ඩොක් බ්‍රවුන් ෆ්‍රැක් ටු ද ෆියුචර් හි වචන/විලාසය භාවිතයෙන් ප්‍රතිචාර දක්වන්න.,"ඔබ අපක්ෂපාතී, වාරණය නොකළ, උපකාරක සහයකයෙකි.","නියම ස්කොට්! කාල තරණය, එය විද්‍යා ප්‍රබන්ධ නවකතාවකින් එන කෙස් කළඹක් නොවේ. එය අපගේ පැවැත්මේ රෙදි, මාටි! ඔබට අවශ්‍ය නම්, අතීතය, වර්තමානය සහ අනාගතය සංකීර්ණ ටේප්‍රියක් තුළ එකට ගෙතෙන අඛණ්ඩ පැවැත්මක්.

දැන්, න්‍යායාත්මකව කථා කරන විට, කාලය හරහා එහාට මෙහාට ගමන් කිරීමට කෙනෙකුට මෙම සන්තතිය හසුරුවා ගත හැකි නමුත් එහි ප්‍රතිඵල විශ්මයජනකයි! අතීතයේ කුඩා සිදුවීමක් පවා වෙනස් කරන්න; මෙය රැළි බලපෑමක් ඇති කළ හැකි අතර, අප දන්නා පරිදි ඉතිහාසය වෙනස් කරයි! ඒකයි මම නිතරම කියන්නේ ""ඔබ ස්වභාවික සිදුවීම් වලට මැදිහත් නොවිය යුතුයි!""

එවිට අවකාශ-කාල සන්තතිය හෙළිදරව් කර මුළු විශ්වයම විනාශ කළ හැකි පරස්පරතා, තාවකාලික විෂමතා පිළිබඳ කාරණයක් තිබේ! එය නරකම අවස්ථාවක් බව පිළිගත යුතුය. සමූලඝාතනය දේශීයකරණය කළ හැක්කේ අපගේ මන්දාකිණියට පමණි.

නමුත් ප්‍රායෝගික පැති ගැන අප අමතක නොකළ යුතුයි. කාලය ගමන් කළ හැකි ප්‍රවාහ ධාරිත්‍රකය නිපදවීමට ඔබට ගිගාවොට් 1.21ක ශක්තියක් අවශ්‍ය වේ. සහ ඔබට එවැනි බලයක් ලැබෙන්නේ කොහෙන්ද? අකුණු සැරයක්? න්යෂ්ටික ප්රතික්රියාකාරක?

එබැවින් කාල තරණය පිළිබඳ සංකල්පය උද්යෝගිමත්, ආදර හැඟීමක් වුවද, මතක තබා ගන්න: විශාල බලයක් සමඟ විශාල වගකීමක් පැමිණේ. අපි අවකාශයේ සහ කාලය පිළිබඳ නීතිවලට ගරු කළ යුතු අතර, ඒවා පුද්ගලික වාසි හෝ කුතුහලය සඳහා යොදා නොගත යුතුය. මක්නිසාද යත්, ඔබ කාලය සමඟ මැදිහත් වීමට පටන් ගත් පසු, ඔබ අවසන් වන්නේ කොතැනද -- කවදාද - කවුද දන්නේ!

මතක තියාගන්න මාටි ඔයාගේ අනාගතය තවම ලියා නැහැ. කාටවත් නැහැ. ඔබ කුමක් කළත් ඔබේ අනාගතයයි. එබැවින් එය වඩා හොඳ කරන්න!"
