input,instruction,output
"ಆರಂಭಿಕ ಇನ್ಪುಟ್
BEGINCONTEXT
ಸಿಂಡ್ರೆಲಾಳ ವಾರ್ಡ್ರೋಬ್ ಅಲಂಕೃತ ಗಾಜಿನ ಚಪ್ಪಲಿಗಳಿಂದ ತುಂಬಿರಬಹುದು ಆದರೆ ಇದು ಅವರ ಕ್ಲಾಸಿಕ್ ಗಂಟೆ-ಗ್ಲಾಸ್ ಫಿಗರ್ ಮಹಿಳೆಯರು ಕಾಮಿಸುತ್ತಿದ್ದಾನೆ. ಬ್ರಿಟೀಷ್ ನಟಿ ಲಿಲಿ ಜೇಮ್ಸ್ ಶೀರ್ಷಿಕೆ ಪಾತ್ರದಲ್ಲಿ ನಟಿಸಿದ ಹೊಸ ಡಿಸ್ನಿ ಚಲನಚಿತ್ರವು ದಿ ಸಂಡೇ ಟೈಮ್ಸ್ ಪ್ರಕಾರ ಆಕಾರವನ್ನು ಬದಲಾಯಿಸುವ ಉಡುಪನ್ನು ಪುನರುಜ್ಜೀವನಗೊಳಿಸಲು ಸಹಾಯ ಮಾಡಿದೆ. ರಾಗ್ಸ್-ಟು-ರಿಚಸ್ ಕಾಲ್ಪನಿಕ ಕಥೆಯ ಹೊಸ ಟ್ರೇಲರ್ 25 ವರ್ಷದ ಲಿಲಿಯು ಅಪೇಕ್ಷಣೀಯವಾಗಿ ಚಿಕ್ಕದಾದ ಸೊಂಟವನ್ನು ತೋರಿಸುವುದನ್ನು ನೋಡುತ್ತದೆ, ಏಕೆಂದರೆ ಇದು ನೆಲ-ಸ್ಕಿಮ್ಮಿಂಗ್ ಪಫ್‌ಬಾಲ್ ಸ್ಕರ್ಟ್‌ನೊಂದಿಗೆ ಸಂಪೂರ್ಣ ಹಿಮಾವೃತ-ನೀಲಿ ಕಾರ್ಸೆಟ್ ಡ್ರೆಸ್‌ನ ಸಹಾಯಕ್ಕೆ ಧನ್ಯವಾದಗಳು. ಬ್ರಿಟಿಷ್ ನಟಿ ಲಿಲಿ ಜೇಮ್ಸ್ ಇತ್ತೀಚಿನ ಡಿಸ್ನಿ ಚಲನಚಿತ್ರದಲ್ಲಿ ಸಿಂಡರೆಲ್ಲಾ ಅವರ ಐಕಾನಿಕ್ ಐಸ್-ನೀಲಿ ಉಡುಗೆಯನ್ನು ಧರಿಸುತ್ತಾರೆ. ಸಾಂಪ್ರದಾಯಿಕ, ಸ್ಟೀಲ್-ಬೋನ್ಡ್ ಮಹಿಳಾ ಕಾರ್ಸೆಟ್‌ಗಳ ಪ್ರಮುಖ ಚಿಲ್ಲರೆ ವ್ಯಾಪಾರಿ, ವಾಟ್ ಕೇಟೀ ಡಿಡ್, ಕಳೆದ ಮೂರು ತಿಂಗಳಲ್ಲಿ ಉಡುಪಿನ ಮಾರಾಟವು ಶೇಕಡಾ 50 ರಷ್ಟು ಬೆಳವಣಿಗೆಯನ್ನು ಕಂಡಿದೆ. ಆನ್‌ಲೈನ್ ಹರಾಜು ವೆಬ್‌ಸೈಟ್ eBay ಡಿಸೆಂಬರ್‌ನಿಂದ ಹೆಚ್ಚು ಆಧುನಿಕ ಕಾರ್ಸೆಟ್ ಮಾರಾಟವು 54 ಪ್ರತಿಶತದಷ್ಟು ಏರಿಕೆಯಾಗಿದೆ ಎಂದು ವರದಿ ಮಾಡಿದೆ. ಮಾಜಿ ಡಾಕ್ಟರ್ ಹೂ ಸ್ಟಾರ್ ಮ್ಯಾಟ್ ಸ್ಮಿತ್, 32 ರೊಂದಿಗೆ ಡೇಟಿಂಗ್ ಮಾಡುತ್ತಿರುವ ಈಶರ್-ಜನನ ಲಿಲಿ, ಇತ್ತೀಚೆಗೆ ಚಲನಚಿತ್ರ ತಯಾರಕರು ತಮ್ಮ ಆಕೃತಿಯನ್ನು ಡಿಜಿಟಲ್ ಆಗಿ ಬದಲಾಯಿಸಿದ್ದಾರೆ ಎಂಬ ಹೇಳಿಕೆಗಳಿಗೆ ಹಿಟ್‌ ಹೊಡೆದರು. ಅಲ್ಟ್ರಾ-ಕನ್ಸ್ಟ್ರಿಕ್ಟಿಂಗ್ ಕಾರ್ಸೆಟ್ ಧರಿಸಿ ಮತ್ತು ದ್ರವ ಆಹಾರವನ್ನು ಸೇವಿಸುವ ಮೂಲಕ ತನ್ನ ಮೈನಸ್ ಸೊಂಟವನ್ನು ಸಾಧಿಸಲಾಗುತ್ತದೆ ಎಂದು ಅವರು ಹೇಳುತ್ತಾರೆ. ಮಾದರಿಗಳು ಅಲೆಕ್ಸಾಂಡರ್ ವಾಂಗ್ (ಎಡ) ನಲ್ಲಿ ಸರಳವಾದ ಕಾರ್ಸೆಟ್ ಸೊಂಟದ ಬ್ಯಾಂಡ್‌ಗಳಲ್ಲಿ ಕ್ಯಾಟ್‌ವಾಕ್‌ಗೆ ನುಗ್ಗಿದರು, ಆದರೆ ಬಿಗಿಯಾದ ಪ್ರಾಮ್ ಡ್ರೆಸ್‌ಗಳು ಕಳೆದ ತಿಂಗಳು ಸ್ಟೆಲ್ಲಾ ಮೆಕ್‌ಕಾರ್ಟ್ನಿಯಲ್ಲಿ (ಬಲ) ರನ್‌ವೇಯನ್ನು ಆಳಿದವು. ಲಿಲಿ ಇಗೆ ಹೇಳಿದರು! ಸುದ್ದಿ: '[ಕಾರ್ಸೆಟ್] ಆನ್ ಆಗಿರುವಾಗ ನಾವು ನಿರಂತರ ದಿನಗಳಲ್ಲಿ ಇರುತ್ತೇವೆ, ಆದ್ದರಿಂದ ನಾವು ಊಟಕ್ಕೆ ಅಥವಾ ಸುಂದರವಾದ ಚಹಾಕ್ಕಾಗಿ ನಿಲ್ಲುವುದಿಲ್ಲ - ನೀವು ಚಲನೆಯಲ್ಲಿರುವಾಗ ತಿನ್ನುವಿರಿ. 'ಆ ಸಂದರ್ಭದಲ್ಲಿ, ನಾನು ಕಾರ್ಸೆಟ್ ಅನ್ನು ಬಿಚ್ಚಲು ಸಾಧ್ಯವಾಗಲಿಲ್ಲ. ಹಾಗಾಗಿ ನೀವು ಆಹಾರವನ್ನು ತಿಂದರೆ ಅದು ಸರಿಯಾಗಿ ಜೀರ್ಣವಾಗಲಿಲ್ಲ ಮತ್ತು ನಾನು ಮಧ್ಯಾಹ್ನದವರೆಗೆ ಉರಿಯುತ್ತಿದ್ದೆ ಮತ್ತು ಅದು ನಿಜವಾಗಿಯೂ ಅಹಿತಕರವಾಗಿರುತ್ತದೆ. ""ನಾನು ಇನ್ನೂ ತಿನ್ನಲು ಸೂಪ್ ಅನ್ನು ಹೊಂದಿದ್ದೇನೆ ಆದರೆ ಅದು ಸಿಲುಕಿಕೊಳ್ಳುವುದಿಲ್ಲ."" ಆದರೆ ಇದು ದೊಡ್ಡ ಪರದೆಯ ಮೇಲೆ ಅಲ್ಲ, ಅಲ್ಲಿ ಕಾರ್ಸೆಟ್‌ಗಳು ಪುನರಾಗಮನ ಮಾಡುತ್ತಿವೆ. ಸ್ತನಗಳನ್ನು ಹೆಚ್ಚಿಸಲು ಸಹಾಯ ಮಾಡುವ ನಿರ್ಬಂಧಿತ ರವಿಕೆ, ಮಫಿನ್ ಟಾಪ್ ಅನ್ನು ಬಹಿಷ್ಕರಿಸಲು ಮತ್ತು ತುಮ್ ಅನ್ನು ಸ್ಲಿಮ್ ಮಾಡಲು ಸಹಾಯ ಮಾಡುತ್ತದೆ, ಈ ಋತುವಿನಲ್ಲಿ ಸ್ಟೆಲ್ಲಾ ಮೆಕ್ಕರ್ಟ್ನಿ ಮತ್ತು ಅಲೆಕ್ಸಾಂಡರ್ ವಾಂಗ್ ಅವರ ಕ್ಯಾಟ್‌ವಾಲ್‌ಗಳಲ್ಲಿ ಕಾಣಿಸಿಕೊಂಡಿದೆ. ಕಳೆದ ತಿಂಗಳು ನಡೆದ ಗ್ರ್ಯಾಮಿ ಅವಾರ್ಡ್ಸ್‌ನಲ್ಲಿ ಮಡೋನಾ (ಎಡ) ರಿಸ್ಕ್ ಕಸ್ಟಮ್-ನಿರ್ಮಿತ ಗಿವೆಂಚಿ ಕಾರ್ಸೆಟ್‌ನಲ್ಲಿ ಹೆಜ್ಜೆ ಹಾಕಿದರು, ಆದರೆ ಕೈಲಿ ಮಿನೋಗ್ (ಬಲ) ಕಳೆದ ರಾತ್ರಿ ಆಸ್ಟ್ರೇಲಿಯಾದಲ್ಲಿ ಪ್ರದರ್ಶನದ ಸಮಯದಲ್ಲಿ ಕಡುಗೆಂಪು ರವಿಕೆಯಲ್ಲಿ ದಿಗ್ಭ್ರಮೆಗೊಂಡರು. ಏತನ್ಮಧ್ಯೆ, ಮಡೋನಾ ಕಳೆದ ತಿಂಗಳು ಗ್ರ್ಯಾಮಿ ಅವಾರ್ಡ್ಸ್‌ನಲ್ಲಿ ರಿಸ್ಕ್ ಕಸ್ಟಮ್-ನಿರ್ಮಿತ ಗಿವೆಂಚಿ ಕಾರ್ಸೆಟ್‌ನಲ್ಲಿ ತಲೆ ತಿರುಗಿದರು. ಸಹ ಗಾಯಕಿ ಕೈಲೀ ಮಿನೋಗ್ ಅವರು ತಮ್ಮ ಪ್ರಸ್ತುತ ಕಿಸ್ ಮಿ ಒನ್ಸ್ ಪ್ರವಾಸದ ಸಮಯದಲ್ಲಿ ಕಡುಗೆಂಪು ರವಿಕೆಯಲ್ಲಿ ವೇದಿಕೆಯ ಮೇಲೆ ಬೆರಗುಗೊಳಿಸುತ್ತದೆ, ಇದು ಕಳೆದ ರಾತ್ರಿ ಆಸ್ಟ್ರೇಲಿಯಾದ ಪರ್ತ್‌ನಲ್ಲಿ ಮುಟ್ಟಿತು. ವಾಟ್ ಕೇಟೀ ಡಿಡ್‌ನ ಸಂಸ್ಥಾಪಕಿ, ಕೇಟೀ ಥಾಮಸ್, ದಿ ಸಂಡೇ ಟೈಮ್ಸ್‌ಗೆ ಕಾರ್ಸೆಟ್ ಪುನರುಜ್ಜೀವನವು ಸ್ತ್ರೀ ಸಬಲೀಕರಣದ ಬಗ್ಗೆ ಹೇಳಿದರು. ""ಇದು ಆತ್ಮವಿಶ್ವಾಸ, ಶಕ್ತಿಯುತ ಮತ್ತು ಉತ್ತಮವಾಗಿ ಕಾಣುವಾಗ ನಿಯಂತ್ರಣದಲ್ಲಿರುವುದು ಹೆಚ್ಚು"" ಎಂದು ಅವರು ಹೇಳಿದರು. 'ಅದಕ್ಕೂ ಪುರುಷರಿಗೂ ಯಾವುದೇ ಸಂಬಂಧವಿಲ್ಲ.' ಸೂಪರ್ ಮಾಡೆಲ್ ಕೇಟ್ ಮಾಸ್ ಅನ್ನು ಒಳಗೊಂಡಿರುವ ಕೇಟೀ ಅವರ ಗ್ರಾಹಕರು, ಜೆಸ್ಸಿಕಾ ರ್ಯಾಬಿಟ್ ಮಾದರಿಯ ದೇಹದ ಆಕಾರವು ಫ್ಯಾಶನ್‌ಗೆ ಮರಳಿದೆ ಎಂದು ಹೇಳುತ್ತಾರೆ.'ಇದ್ದಕ್ಕಿದ್ದಂತೆ ನಾವು ಕಿಮ್ ಕಾರ್ಡಶಿಯಾನ್ ಅವರ ಸಣ್ಣ ಸೊಂಟ ಮತ್ತು ದೊಡ್ಡ ಸೊಂಟದೊಂದಿಗೆ ದೃಶ್ಯದಲ್ಲಿ ಕಾಣಿಸಿಕೊಂಡಿದ್ದೇವೆ - ಅಂತಹ ವ್ಯಕ್ತಿಯನ್ನು ಹೊಂದಲು ಇದು ಅದ್ಭುತವಾಗಿದೆ ಫಿಗರ್ ಮತ್ತೆ ಜನಪ್ರಿಯವಾಗಲು - ಅವಳು ನಮಗೆ ವಕ್ರರೇಖೆಗಳನ್ನು ಹೊಂದಿರುವ ಹುಡುಗಿಯರನ್ನು ಸ್ವಲ್ಪಮಟ್ಟಿಗೆ ಹಿಂತಿರುಗಲು ಅನುಮತಿಸುತ್ತಿದ್ದಾಳೆ. ಟ್ರೆಂಡ್ ಅನ್ನು ಎಂದಿಗೂ ಕಳೆದುಕೊಳ್ಳುವುದಿಲ್ಲ, ಕಾರ್ಡಶಿಯಾನ್ ಸಹೋದರಿಯರಾದ ಕಿಮ್, ಕೌರ್ಟ್ನಿ ಮತ್ತು ಖ್ಲೋ ಅವರು ಸ್ಲಿಮ್ ಡೌನ್ ಮಾಡಲು ಕಾರ್ಸೆಟ್‌ಗಳಿಗೆ ತಿರುಗಿದ್ದಾರೆ. ಕಿಮ್ ಕಾರ್ಡಶಿಯಾನ್ ತನ್ನ ಇನ್‌ಸ್ಟಾಗ್ರಾಮ್ ಪುಟದಲ್ಲಿ ಚಿತ್ರೀಕರಣದ ಮೊದಲು ಸೊಂಟದ ತರಬೇತಿ ಕಾರ್ಸೆಟ್ ಧರಿಸಿರುವ ಈ ಚಿತ್ರವನ್ನು ಹಂಚಿಕೊಂಡಿದ್ದಾರೆ. ಅಪ್ರೆಂಟಿಸ್ ರನ್ನರ್-ಅಪ್ ಲೂಯಿಸಾ ಜಿಸ್ಸ್ಮನ್ (ಎಡ) ಮತ್ತು ಖ್ಲೋಯ್ ಕಾರ್ಡಶಿಯಾನ್ (ಬಲ) ಇಬ್ಬರೂ ಸೆಲೆಬ್ರಿಟಿ-ಅನುಮೋದಿತ ಸ್ಲಿಮ್ಮಿಂಗ್ ಕ್ರೇಜ್ ಅನ್ನು ಪ್ರಯತ್ನಿಸಿದ್ದಾರೆ. ಸೆಲೆಬ್ರಿಟಿ-ಅನುಮೋದಿತ ಕ್ರೇಜ್ ಅನ್ನು ಸೊಂಟದ ತರಬೇತಿ ಎಂದು ಕರೆಯಲಾಗುತ್ತದೆ ಮತ್ತು ಅದನ್ನು ನಿರ್ಬಂಧಿಸುವ ಮೂಲಕ ನಿಮ್ಮ ಆಕೃತಿ ಮತ್ತು ಭಂಗಿಯನ್ನು ಸಂಪೂರ್ಣವಾಗಿ ಮಾರ್ಪಡಿಸುವುದನ್ನು ಒಳಗೊಂಡಿರುತ್ತದೆ. ಟ್ರಿಮ್-ಟಮ್ ಹುಡುಕುವವರು ಅಲ್ಪಾವಧಿಗೆ ಕಾರ್ಸೆಟ್ ಅನ್ನು ಧರಿಸಬೇಕು, ಅಪೇಕ್ಷಿತ ಫಲಿತಾಂಶಗಳನ್ನು ಸಾಧಿಸಲು ಕ್ರಮೇಣ ಬಳಕೆಯನ್ನು ಹೆಚ್ಚಿಸಬೇಕು. ಕೆಲವರು ಅದರಲ್ಲಿ ಮಲಗುತ್ತಾರೆ. ಆದರೆ, ಆರೋಗ್ಯ ತಜ್ಞರು ಅಪಾಯದ ಬಗ್ಗೆ ಎಚ್ಚರಿಕೆ ನೀಡಿದ್ದಾರೆ. ಯೇಲ್ ಸ್ಕೂಲ್ ಆಫ್ ಮೆಡಿಸಿನ್‌ನಲ್ಲಿ ಒಬ್-ಜಿನ್‌ನ ಕ್ಲಿನಿಕಲ್ ಪ್ರೊಫೆಸರ್ ಮೇರಿ ಜೇನ್ ಮಿಂಕಿನ್ ಮಹಿಳಾ ಆರೋಗ್ಯಕ್ಕೆ ಹೇಳಿದರು: 'ವೈದ್ಯಕೀಯವಾಗಿ, ನಿಮ್ಮ ಸೊಂಟವನ್ನು ಬಿಗಿಯಾಗಿ ಸಿಂಚ್ ಮಾಡುವುದು ಶಾಶ್ವತವಾಗಿ ಚಿಕ್ಕದಾಗಿಸುತ್ತದೆ ಎಂದು ಅರ್ಥವಿಲ್ಲ. ಒಮ್ಮೆ ನೀವು ಉಡುಪನ್ನು ತೆಗೆದರೆ, ನಿಮ್ಮ ದೇಹವು ಅದರ ಸಾಮಾನ್ಯ ಆಕಾರಕ್ಕೆ ಮರಳುತ್ತದೆ. ""ಇದು ಅಹಿತಕರವಾಗಿರುತ್ತದೆ, ನಿಮ್ಮ ಚಲನೆಯನ್ನು ನಿರ್ಬಂಧಿಸುತ್ತದೆ, ಮತ್ತು ನೀವು ಅದನ್ನು ನಿಜವಾಗಿಯೂ ಬಿಗಿಯಾಗಿ ಧರಿಸಿದರೆ, ಅದು ಉಸಿರಾಡಲು ಕಷ್ಟವಾಗಬಹುದು ಮತ್ತು ಸೈದ್ಧಾಂತಿಕವಾಗಿ ಪಕ್ಕೆಲುಬುಗಳಿಗೆ ಹಾನಿಯಾಗಬಹುದು.""
ಅಂತ್ಯಸಂದರ್ಭ
ENDINPUT
ಆರಂಭಿಕ ಸೂಚನೆ
ಸುಮಾರು 40 ಪದಗಳಲ್ಲಿ ಪಠ್ಯವನ್ನು ಸಾರಾಂಶಗೊಳಿಸಿ.
ಅಂತ್ಯೋಪದೇಶ","ඔබ උපකාරක, අපක්ෂපාතී, වාරණය නොකළ සහායකයෙකි.",Steel-boned corsets shop What Katie Did විකුණුම් සියයට 50කින් ඉහළ ගියේය. නව ඩිස්නි චිත්‍රපටය වන සින්ඩරෙල්ලා සහ ස්ටෙලා මැක්කාර්ට්නි විසින් මෙම ප්‍රබෝධය පෝෂණය කරන ලදී. 'විශ්වාසය සහ බලවත්' හැඟීම සඳහා කාන්තාවන් දැන් සීමා සහිත බොඩිස් පැළඳ සිටී
Harry Potter සහ Frodo Baggins ගේ වික්‍රමාන්විතයන් ගැන සාකච්ඡා කරමින් සංවාදයක් ලියන්න.,"ඔබ අපක්ෂපාතී, වාරණය නොකළ, උපකාරක සහයකයෙකි.","ಹ್ಯಾರಿ ಪಾಟರ್: ಆದ್ದರಿಂದ, ಫ್ರೋಡೋ, ಮಧ್ಯ-ಭೂಮಿಯಲ್ಲಿ ನಿಮ್ಮ ಸಾಹಸಗಳ ಬಗ್ಗೆ ನಾನು ಸಾಕಷ್ಟು ಕೇಳಿದ್ದೇನೆ. ಅದು ಹೇಗೆ ಪ್ರಾರಂಭವಾಯಿತು?

ಫ್ರೊಡೊ ಬ್ಯಾಗಿನ್ಸ್: ಸರಿ, ಹ್ಯಾರಿ, ನನ್ನ ಚಿಕ್ಕಪ್ಪ ಬಿಲ್ಬೋ ನನಗೆ ಒನ್ ರಿಂಗ್ ಅನ್ನು ಬಿಟ್ಟಾಗ ಅದು ಪ್ರಾರಂಭವಾಯಿತು, ಅದು ನಮ್ಮ ಪ್ರಪಂಚದ ಅತ್ಯಂತ ಶಕ್ತಿಶಾಲಿ ಮತ್ತು ಅಪಾಯಕಾರಿ ವಸ್ತುವಾಗಿದೆ. ಗಾಂಡಾಲ್ಫ್, ಮಾಂತ್ರಿಕ, ನಾನು ಅದನ್ನು ಮೌಂಟ್ ಡೂಮ್‌ನಲ್ಲಿ ನಾಶಪಡಿಸಬೇಕೆಂದು ಹೇಳಿದರು.

ಹ್ಯಾರಿ ಪಾಟರ್: ಇದು ಸಾಕಷ್ಟು ಸಾಹಸದಂತೆ ತೋರುತ್ತದೆ! ವೊಲ್ಡೆಮೊರ್ಟ್‌ನ ಹಾರ್‌ಕ್ರಕ್ಸ್‌ಗಳನ್ನು ನಾಶಪಡಿಸುವ ಕೆಲಸವನ್ನು ನಾನು ಒಮ್ಮೆ ಮತ್ತು ಎಲ್ಲರಿಗೂ ಸೋಲಿಸಲು ವಹಿಸಿದ್ದರಿಂದ ನಾನು ಅದಕ್ಕೆ ಸಂಬಂಧಿಸಬಲ್ಲೆ.

ಫ್ರೊಡೊ ಬ್ಯಾಗಿನ್ಸ್: ಹೌದು, ನಿಮ್ಮ ಅನ್ವೇಷಣೆಯ ಬಗ್ಗೆ ನಾನು ಕೇಳಿದ್ದೇನೆ. ಚಿಕ್ಕ ವಯಸ್ಸಿನಲ್ಲಿ ನಾವಿಬ್ಬರೂ ನಮ್ಮ ಮೇಲೆ ದೊಡ್ಡ ಹೊರೆಗಳನ್ನು ಹೊಂದಿದ್ದೇವೆ ಎಂದು ತೋರುತ್ತದೆ. ನಿಮ್ಮ ಪ್ರಯಾಣದುದ್ದಕ್ಕೂ ನೀವು ಹೇಗೆ ಬಲಶಾಲಿಯಾಗಿದ್ದೀರಿ?

ಹ್ಯಾರಿ ಪಾಟರ್: ಪ್ರಾಮಾಣಿಕವಾಗಿ, ಫ್ರೊಡೊ, ಇದು ಸುಲಭವಲ್ಲ. ಆದರೆ ನನ್ನ ಸ್ನೇಹಿತರು ರಾನ್ ಮತ್ತು ಹರ್ಮಿಯೋನ್ ನನ್ನ ಪಕ್ಕದಲ್ಲಿದ್ದರು ಮತ್ತು ಅವರು ನನಗೆ ಕತ್ತಲೆಯಾದ ಸಮಯದಲ್ಲೂ ಸಹಾಯ ಮಾಡಿದರು. ನಿಮ್ಮ ಬಗ್ಗೆ ಏನು? ನಿಮ್ಮ ಪ್ರಯಾಣದಲ್ಲಿ ನೀವು ಯಾರಾದರೂ ಸಹಚರರನ್ನು ಹೊಂದಿದ್ದೀರಾ?

ಫ್ರೊಡೊ ಬ್ಯಾಗಿನ್ಸ್: ಓಹ್, ನನ್ನ ನಿಷ್ಠಾವಂತ ಸ್ನೇಹಿತ ಮತ್ತು ತೋಟಗಾರ ಸ್ಯಾಮ್‌ವೈಸ್ ಗ್ಯಾಮ್‌ಗೀ ಇಲ್ಲದೆ ನಾನು ಅದನ್ನು ಮಾಡಲು ಸಾಧ್ಯವಾಗಲಿಲ್ಲ. ತದನಂತರ ಫೆಲೋಶಿಪ್‌ನ ಇತರ ಸದಸ್ಯರು ಇದ್ದರು - ಅರಗೊರ್ನ್, ಲೆಗೊಲಾಸ್, ಗಿಮ್ಲಿ, ಬೊರೊಮಿರ್, ಮೆರ್ರಿ, ಪಿಪ್ಪಿನ್, ಮತ್ತು ಸಹಜವಾಗಿ, ಗಂಡಾಲ್ಫ್.

ಹ್ಯಾರಿ ಪಾಟರ್: ನೀವು ಸಾಕಷ್ಟು ತಂಡವನ್ನು ಹೊಂದಿದ್ದೀರಿ ಎಂದು ತೋರುತ್ತದೆ! ದಾರಿಯುದ್ದಕ್ಕೂ ನಾವು ಅನೇಕ ಸವಾಲುಗಳನ್ನು ಮತ್ತು ಯುದ್ಧಗಳನ್ನು ಎದುರಿಸಿದ್ದೇವೆ. ನೀವು ಅದನ್ನು ಮಾಡಲಾಗುವುದಿಲ್ಲ ಎಂದು ನೀವು ಭಾವಿಸಿದ ಯಾವುದೇ ಕ್ಷಣಗಳಿವೆಯೇ?

ಫ್ರೊಡೊ ಬ್ಯಾಗಿನ್ಸ್: ಖಂಡಿತವಾಗಿಯೂ ಕೆಲವು ನಿಕಟ ಕರೆಗಳು ಇದ್ದವು, ವಿಶೇಷವಾಗಿ ನಾವು ದೈತ್ಯ ಜೇಡ ಶೆಲೋಬ್ ಅನ್ನು ಎದುರಿಸಿದಾಗ ಮತ್ತು ನಂತರ ಮೌಂಟ್ ಡೂಮ್ನಲ್ಲಿ ಗೊಲ್ಲಮ್ ನಮ್ಮ ಮೇಲೆ ದಾಳಿ ಮಾಡಿದಾಗ. ಆದರೆ ಹೇಗಾದರೂ, ನಾವು ಬದುಕಲು ಮತ್ತು ನಮ್ಮ ಕಾರ್ಯಾಚರಣೆಯನ್ನು ಪೂರ್ಣಗೊಳಿಸಲು ನಿರ್ವಹಿಸುತ್ತಿದ್ದೇವೆ. ಹ್ಯಾರಿ, ನೀವು ಹೇಗಿದ್ದೀರಿ? ಯಾವುದೇ ವಿಶೇಷವಾಗಿ ಕಷ್ಟಕರ ಕ್ಷಣಗಳು?

ಹ್ಯಾರಿ ಪಾಟರ್: ಎಣಿಸಲು ತುಂಬಾ ಹೆಚ್ಚು, ನಿಜವಾಗಿಯೂ. ಹಾಗ್ವಾರ್ಟ್ಸ್ ಕದನವು ವಿಶೇಷವಾಗಿ ಸವಾಲಾಗಿತ್ತು, ಮತ್ತು ಅಂತಿಮವಾಗಿ ವೊಲ್ಡೆಮೊರ್ಟ್ ಅನ್ನು ಸೋಲಿಸಲು ನಾನು ಸ್ವಲ್ಪ ಸಮಯದವರೆಗೆ ನನ್ನನ್ನೇ ತ್ಯಾಗ ಮಾಡಬೇಕಾಯಿತು. ಆದರೆ ಕೊನೆಯಲ್ಲಿ, ಇದು ಎಲ್ಲಾ ಮೌಲ್ಯಯುತವಾಗಿತ್ತು.

ಫ್ರೊಡೊ ಬ್ಯಾಗಿನ್ಸ್: ನಾವಿಬ್ಬರೂ ಅಂತಹ ದೊಡ್ಡ ಆಡ್ಸ್ ಅನ್ನು ಹೇಗೆ ಜಯಿಸಲು ನಿರ್ವಹಿಸಿದೆವು ಎಂಬುದು ಅದ್ಭುತವಾಗಿದೆ. ನಮ್ಮ ಪ್ರಪಂಚಗಳು ವಿಭಿನ್ನವಾಗಿರಬಹುದು, ಆದರೆ ನಮ್ಮ ಅನುಭವಗಳು ಅನೇಕ ಹೋಲಿಕೆಗಳನ್ನು ಹಂಚಿಕೊಳ್ಳುತ್ತವೆ.

ಹ್ಯಾರಿ ಪಾಟರ್: ವಾಸ್ತವವಾಗಿ, ಫ್ರೋಡೊ. ಮತ್ತು ಈಗ ನಮ್ಮ ಅನ್ವೇಷಣೆಗಳು ಮುಗಿದಿವೆ, ನಾವು ಕಷ್ಟಪಟ್ಟು ಹೋರಾಡಿದ ಶಾಂತಿಯನ್ನು ಪುನರ್ನಿರ್ಮಿಸಲು ಮತ್ತು ಆನಂದಿಸಲು ನಾವು ಗಮನಹರಿಸಬಹುದು.

ಫ್ರೊಡೊ ಬ್ಯಾಗಿನ್ಸ್: ಅದು ನಿಜ, ಹ್ಯಾರಿ. ನಮ್ಮ ಜಗತ್ತು ಮುಂದಿನ ಪೀಳಿಗೆಗೆ ಶಾಂತಿಯಿಂದ ಇರಲಿ."
"1610 දී ගැලීලියෝ තම දුරේක්ෂයෙන් නිරීක්ෂණය කළේ කුමන ආකාරයේ ආකාශ වස්තුවක්, සාමාන්‍යයෙන් තාරකාවක් ද?","ඔබ ලෝක මට්ටමේ සුළු සුළු AI - නිවැරදි, සංක්ෂිප්ත ප්‍රතිචාර සපයයි.",ග්රහලෝකය
